{
  "id": "f51f8930-c937-4c66-9db8-d4d313e6d286",
  "from": 1764284400000,
  "to": 1766530800000,
  "parent": null,
  "childPhaseIds": [
    "ab939925-1be6-43fc-b7a9-958b49b2c66a",
    "4c960ff4-05ba-4ff8-b523-1a104d750503",
    "61ebf544-cd45-48d1-9c11-9763e8674ce1"
  ],
  "commitments": [
    "865e4b34-0c68-4e34-9361-809c4d90db4c",
    "d59d03c1-45dd-48db-98c2-49b61b481f07",
    "1c60ee55-0627-43d6-8393-e912fc2e52a2",
    "abc3d503-5945-45eb-8122-be5e33b2ccea",
    "c858c337-506e-494b-bfe3-c32e4db02aaf",
    "0f577668-ca34-4e7a-a7a8-9f97bc91454e",
    "97d2e473-64b4-4de8-99c8-d8a7a064ee43",
    "33be4e0c-fa52-42ba-a86b-4c209b34e2be",
    "a776e5cc-0302-48f0-8e90-e85354851feb",
    "f2337265-ffc6-4ae8-a421-d6e4d5540210",
    "36794f88-d947-45bb-a6b6-5f8da034ed0f",
    "1d0dcba3-11da-44c9-a66d-ed80ac100ea5",
    "5619ff4e-999d-4908-a2d6-09cb730bfa41",
    "ca93615f-6364-4b90-aa3a-1e78c9939e55",
    "b4903845-c07b-482a-a6c6-a5c9fdf3de71",
    "802342cf-de8f-4614-8915-74e7a0800980",
    "dec42d50-03ca-4dce-9e1f-31f6c20a7b52",
    "f0c0ffe0-4460-4346-97e4-4cd423b3fefa",
    "f545d42a-0b43-4587-97f2-67eede424f99",
    "77383b31-f45d-4994-be03-d3aed0f16f1c",
    "dc0f6634-8873-4f1b-8bd1-5ac72dbf8759",
    "0b63290f-d42e-44c5-b0ba-e92a37fc67cb",
    "49258e32-69a4-4b61-9cc4-a54bac439d32",
    "c71bb0e6-9822-49a3-83dd-d6e6d0649433",
    "3ed98052-9d15-466e-b3a5-3082ba3e50b3",
    "65f63194-8cf2-4355-b687-f1df2759e5ee",
    "bed74658-63e8-4a7b-b7ab-b69655b39cd8",
    "0e931650-0fdb-4a3a-9f44-6dd05cf1ceac",
    "b3c1bd1a-a503-45af-8c3a-3d3bee567f47"
  ],
  "name": "next-level"
}
