{
  "id": "ab939925-1be6-43fc-b7a9-958b49b2c66a",
  "from": 1765238400000,
  "to": 1765843200000,
  "order": 5,
  "parent": "f51f8930-c937-4c66-9db8-d4d313e6d286",
  "childPhaseIds": [],
  "commitments": [
    "50188560-6c74-4005-8061-7e1090f28895",
    "726a6360-6e93-4a0f-95b6-1863af2600e5",
    "81812958-054f-4da1-b6fa-62c930b7014d",
    "8419f493-e9ee-4917-b858-32bdbb0b2dca",
    "93af91df-704e-4d84-9b9b-f9feed6898b9",
    "997f5b3c-ad9b-4187-a4a2-34bb86daf1b7",
    "cb96039f-3f52-42ac-be2f-4023679f44a2",
    "dc90ccef-5e1e-4a57-ae57-9833bde682fd",
    "dfee4708-69b8-4850-8228-e59cdc4e5860",
    "eaabc313-ff9c-418b-9d7e-3fc84dd06af1",
    "2a32fb69-21e3-49d9-abe2-68e1ba1365dc"
  ],
  "name": "Social Automation Sprint"
}
