{
  "id": "8497d7b8-7729-4dde-b868-3cdcd2a749d6",
  "from": 1787522400000,
  "to": 1788213599000,
  "parent": "bb7ce28d-0eee-4243-a489-fd4eab223c35",
  "childPhaseIds": [],
  "commitments": [
    "86d965a6-3f9b-41ba-97c1-86c51323bcd7"
  ],
  "name": "August · trip-content readiness · by 31 Aug 2026"
}
