{
  "id": "618b92d0-70cc-434c-b2b5-ee9fcfefc25a",
  "from": 1767225600000,
  "to": 1774915200000,
  "parent": "9a4b8d5f-b63a-4704-a74d-4bc82f9c03b5",
  "childPhaseIds": [
    "5c2f9450-0feb-4755-b59a-081e9ab43037",
    "2abfd425-ee90-4286-a019-ba0ff703c73a",
    "9e2e29ae-54b9-4844-b833-0344d6d18951",
    "33ccb9f5-38de-463b-b7be-7c5615817564"
  ],
  "commitments": [
    "0cefe646-447b-412a-b4f6-53167668b0ee",
    "0d6d4f9c-cc6c-4072-9765-996aac58cd22",
    "0f8868ba-7ac5-46f7-a23a-7ca3e0cb43d4",
    "035f3963-180a-49c2-8d42-8889ed5dbc50",
    "ad4776b8-7dfe-47f5-8bc6-54a4f9d39d68",
    "5dd6a07a-5e23-4eec-a674-6c28e8096e6c",
    "0855f086-1055-4214-81d5-a422e1189707",
    "b3fa8f91-37d5-45d6-86c0-bf6c5afcb8dc",
    "88d7bcb6-c79e-43c3-963f-cfd7d8deb354",
    "8ae9e8da-69aa-4321-8d66-2533716daf58",
    "54afad1d-4660-4908-8043-eeea348eaf90",
    "9c44aab0-68cd-42ba-a192-272459bea4f1",
    "17f8e9b2-ba9c-420c-a099-c0912db7275b",
    "c58ae2b8-9d4b-444e-8c07-5d25e6b6fc1b",
    "8e63ff9c-f48f-40fe-b7f5-bb94fd0af200",
    "6bfa572e-b451-44e0-b36d-fe4e3ab6f582",
    "cf695de6-3a8e-4830-a274-14a942998c04",
    "ff2e9a3b-b65e-4e45-abec-c19cffe59bad",
    "9f83a877-1b9d-42a4-a7f8-72344ff27459",
    "d7f7b02f-e650-4cb5-aeaa-e7ef36279b67",
    "980ccb42-ff50-4384-8bab-cfe9646e83f0",
    "e0289c2f-8fe7-4875-a46a-21709c8d8295",
    "e2846e8e-29e8-4584-b250-9e0dcfd3c787",
    "bc9b94d3-606f-4756-a22a-52444f6021ef",
    "f1550eb7-d02e-40bc-af94-1fb1076076bd",
    "bc0a18cf-63c5-413f-9faf-5a312241deff",
    "96adb3d0-5827-432e-8a48-8d26754fcaed",
    "73e72297-47c8-4a88-b7eb-5d6e7e575001",
    "0eba57d1-6f4f-49a1-bf75-a793792d7d6f",
    "69321b93-d540-45a9-9a25-8f2d5254d43c",
    "365e78d0-ed64-47d7-9902-b575d493c6e4",
    "c4ab85c2-0497-48de-ae93-3dc7b4c2aa60",
    "3427a68e-791e-4f59-bc46-bd72d85e6d71",
    "756cf129-0c66-43dd-84cf-58e94450e325",
    "22c4140b-9ae2-4805-9071-a3f30b1c4ec3",
    "3ea51517-fc9c-4215-ac5b-79ec2a21f6b2",
    "fa09c443-dd67-48c9-9655-122b18c4defd",
    "fc51df6c-c059-4181-9645-a1ed11cd6beb",
    "992b990a-d90f-4cf9-8ec6-e1ff4678b1bf",
    "541a9365-8d41-4835-aab7-823f5807b6fb",
    "e2dc1422-5f19-4841-9f17-d38296886461",
    "6da6ecb2-04e7-426e-95d1-66566d11182b",
    "3c0b4344-07bd-48b5-a800-6cf02332ea45",
    "324c369b-1227-433f-b853-7ad79dec920b",
    "5558caa1-cb54-40a9-a383-8b4c77568226",
    "b2d985ab-398d-4c68-b781-9ceaac505f81",
    "439230f6-4347-4abc-a23b-2f67e58739bd",
    "facbacb5-1589-4b73-8ecb-97d7bb32bd99",
    "9594aa9b-e7f0-4879-9d9b-52ae20f8a52d",
    "74b079de-667c-47f6-8017-fb202e2affd9",
    "038522a0-3f35-4f06-82ef-2dd0b2d3736e",
    "0fee8918-1087-4e7f-bb0e-ba506be3a8c6",
    "67c40d89-123f-4c3b-a8aa-0b703d274b14",
    "dadcd0a7-511b-4152-b971-2c11ea17bc40",
    "2ff1fd7a-7e02-4197-a558-174622db7cbe",
    "300f5452-f7e9-452d-9f3e-078c988e8af8",
    "b69e9372-2207-4624-8a18-9a814f3938b2",
    "fa735173-548c-4830-84a4-de7738024cf7",
    "f2337265-ffc6-4ae8-a421-d6e4d5540210"
  ],
  "name": "Q1 2026: Scale Experience Mining"
}
